[
  {
    "id": "CN-MFG-0021659",
    "company": "南京贵金属回收",
    "category": "电子元器件",
    "keywords": [
      "线路板"
    ],
    "region": {
      "province": "江苏",
      "city": "南京",
      "district": "栖霞"
    },
    "address": "迈皋桥街道迈尧路379号金源百货第壹层K区3号",
    "contact_phone": "181****3818",
    "lat": 32.119381,
    "lng": 118.839142,
    "source": "public_directory",
    "source_url": "https://www.amap.com/place/B0MG0UHH5E",
    "verified_at": "2026-08-13",
    "is_template": false,
    "note": "",
    "amap": {
      "poi_id": "B0MG0UHH5E",
      "type": "生活服务;生活服务场所;生活服务场所",
      "typecode": "070000",
      "alias": "",
      "tag": "",
      "keytag": "金银回收",
      "website": "",
      "email": "",
      "postcode": "",
      "business_area": "",
      "adcode": "320113",
      "search_keyword": "线路板"
    },
    "industry": {
      "code": "3253",
      "name": "贵金属压延加工",
      "level": "class",
      "path": "C 制造业 > 有色金属冶炼和压延加工业 > 有色金属压延加工 > 贵金属压延加工",
      "confidence": "high",
      "source": "gb_token",
      "evidence": "贵金属"
    },
    "is_manufacturer": true,
    "status": "verified"
  },
  {
    "id": "CN-MFG-0039812",
    "company": "贵金属激光切割",
    "category": "钣金冲压",
    "keywords": [
      "激光切割"
    ],
    "region": {
      "province": "广东",
      "city": "广州",
      "district": "番禺"
    },
    "address": "沙头街中心幼儿园西北门北120米",
    "contact_phone": "待核实",
    "lat": 22.949821,
    "lng": 113.341353,
    "source": "public_directory",
    "source_url": "https://www.amap.com/place/B0GK1UYN08",
    "verified_at": "2026-09-15",
    "imported_at": "2026-09-15",
    "last_verified_at": null,
    "status": "unverified_poi",
    "is_template": true,
    "note": "",
    "amap": {
      "poi_id": "B0GK1UYN08",
      "type": "生活服务;生活服务场所;生活服务场所",
      "typecode": "070000",
      "alias": "",
      "tag": "",
      "keytag": "生活服务,生活服务场所,生活服务场所",
      "website": "",
      "email": "",
      "postcode": "",
      "business_area": "市桥",
      "adcode": "440113",
      "search_keyword": "激光切割"
    },
    "industry": {
      "code": "3253",
      "name": "贵金属压延加工",
      "level": "class",
      "path": "C 制造业 > 有色金属冶炼和压延加工业 > 有色金属压延加工 > 贵金属压延加工",
      "confidence": "high",
      "source": "gb_token",
      "evidence": "贵金属"
    },
    "is_manufacturer": true
  },
  {
    "id": "CN-MFG-0159878",
    "company": "小福贵金属有限公司",
    "category": "钣金冲压",
    "keywords": [
      "金属制品"
    ],
    "region": {
      "province": "广东",
      "city": "深圳",
      "district": "龙岗区"
    },
    "address": "平盐路与横盐路交叉口西南120米",
    "contact_phone": "0755-28284241",
    "lat": 22.613211,
    "lng": 114.232876,
    "source": "public_directory",
    "source_url": "",
    "verified_at": "2026-09-25",
    "imported_at": "2026-09-25",
    "last_verified_at": null,
    "status": "verified",
    "is_template": false,
    "note": "",
    "amap": {
      "poi_id": "B0FFJ9D0S0",
      "type": "公司企业;公司企业;公司企业",
      "typecode": "170000",
      "alias": "",
      "tag": "",
      "keytag": "公司",
      "website": "",
      "email": "",
      "postcode": "",
      "business_area": "",
      "adcode": "440307",
      "search_keyword": "金属制品"
    },
    "industry": {
      "code": "3253",
      "name": "贵金属压延加工",
      "level": "class",
      "path": "C 制造业 > 有色金属冶炼和压延加工业 > 有色金属压延加工 > 贵金属压延加工",
      "confidence": "high",
      "source": "gb_token",
      "evidence": "贵金属"
    },
    "is_manufacturer": true
  },
  {
    "id": "CN-MFG-0159880",
    "company": "深圳市点金贵金属精炼有限公司",
    "category": "钣金冲压",
    "keywords": [
      "金属制品"
    ],
    "region": {
      "province": "广东",
      "city": "深圳",
      "district": "宝安区"
    },
    "address": "坑尾大道与坑尾村路交叉口北100米",
    "contact_phone": "0755-25508906",
    "lat": 22.694185,
    "lng": 113.937529,
    "source": "public_directory",
    "source_url": "",
    "verified_at": "2026-09-25",
    "imported_at": "2026-09-25",
    "last_verified_at": null,
    "status": "verified",
    "is_template": false,
    "note": "",
    "amap": {
      "poi_id": "B0JAR13PUA",
      "type": "公司企业;工厂;工厂",
      "typecode": "170300",
      "alias": "",
      "tag": "",
      "keytag": "公司",
      "website": "",
      "email": "",
      "postcode": "",
      "business_area": "",
      "adcode": "440306",
      "search_keyword": "金属制品"
    },
    "industry": {
      "code": "3253",
      "name": "贵金属压延加工",
      "level": "class",
      "path": "C 制造业 > 有色金属冶炼和压延加工业 > 有色金属压延加工 > 贵金属压延加工",
      "confidence": "high",
      "source": "gb_token",
      "evidence": "贵金属"
    },
    "is_manufacturer": true
  },
  {
    "id": "CN-MFG-0159882",
    "company": "宝丰贵金属设备有限公司",
    "category": "钣金冲压",
    "keywords": [
      "金属制品"
    ],
    "region": {
      "province": "广东",
      "city": "深圳",
      "district": "龙岗区"
    },
    "address": "横岗安华路56号(福坑地铁站C口步行80米)",
    "contact_phone": "0755-28883730",
    "lat": 22.636556,
    "lng": 114.221746,
    "source": "public_directory",
    "source_url": "",
    "verified_at": "2026-09-25",
    "imported_at": "2026-09-25",
    "last_verified_at": null,
    "status": "verified",
    "is_template": false,
    "note": "",
    "amap": {
      "poi_id": "B0FFH91YRA",
      "type": "公司企业;公司;公司",
      "typecode": "170200",
      "alias": "",
      "tag": "",
      "keytag": "公司",
      "website": "",
      "email": "",
      "postcode": "",
      "business_area": "横岗",
      "adcode": "440307",
      "search_keyword": "金属制品"
    },
    "industry": {
      "code": "3253",
      "name": "贵金属压延加工",
      "level": "class",
      "path": "C 制造业 > 有色金属冶炼和压延加工业 > 有色金属压延加工 > 贵金属压延加工",
      "confidence": "high",
      "source": "gb_token",
      "evidence": "贵金属"
    },
    "is_manufacturer": true
  },
  {
    "id": "CN-MFG-0159902",
    "company": "寰宇贵金属科技有限公司",
    "category": "钣金冲压",
    "keywords": [
      "金属制品"
    ],
    "region": {
      "province": "广东",
      "city": "深圳",
      "district": "龙岗区"
    },
    "address": "中始埔路16号中和盛世珠宝文化创新创意产业园E区九栋1楼",
    "contact_phone": "135****7192",
    "lat": 22.623987,
    "lng": 114.183245,
    "source": "public_directory",
    "source_url": "",
    "verified_at": "2026-09-25",
    "imported_at": "2026-09-25",
    "last_verified_at": null,
    "status": "verified",
    "is_template": false,
    "note": "",
    "amap": {
      "poi_id": "B0FFM3UOXB",
      "type": "公司企业;公司;公司",
      "typecode": "170200",
      "alias": "",
      "tag": "",
      "keytag": "公司",
      "website": "",
      "email": "",
      "postcode": "",
      "business_area": "横岗",
      "adcode": "440307",
      "search_keyword": "金属制品"
    },
    "industry": {
      "code": "3253",
      "name": "贵金属压延加工",
      "level": "class",
      "path": "C 制造业 > 有色金属冶炼和压延加工业 > 有色金属压延加工 > 贵金属压延加工",
      "confidence": "high",
      "source": "gb_token",
      "evidence": "贵金属"
    },
    "is_manufacturer": true
  },
  {
    "id": "CN-MFG-0159904",
    "company": "深圳市银昌贵金属有限公司",
    "category": "钣金冲压",
    "keywords": [
      "金属制品"
    ],
    "region": {
      "province": "广东",
      "city": "深圳",
      "district": "罗湖区"
    },
    "address": "翠竹路与田贝四路交叉口西北120米",
    "contact_phone": "135****0390",
    "lat": 22.568075,
    "lng": 114.129125,
    "source": "public_directory",
    "source_url": "",
    "verified_at": "2026-09-25",
    "imported_at": "2026-09-25",
    "last_verified_at": null,
    "status": "verified",
    "is_template": false,
    "note": "",
    "amap": {
      "poi_id": "B0L117LPFG",
      "type": "公司企业;公司;公司|金融保险服务;金融保险服务机构;金融保险机构",
      "typecode": "170200|160000",
      "alias": "",
      "tag": "",
      "keytag": "公司",
      "website": "",
      "email": "",
      "postcode": "",
      "business_area": "翠竹",
      "adcode": "440303",
      "search_keyword": "金属制品"
    },
    "industry": {
      "code": "3253",
      "name": "贵金属压延加工",
      "level": "class",
      "path": "C 制造业 > 有色金属冶炼和压延加工业 > 有色金属压延加工 > 贵金属压延加工",
      "confidence": "high",
      "source": "gb_token",
      "evidence": "贵金属"
    },
    "is_manufacturer": true
  }
]