[
  {
    "id": "CN-MFG-0010715",
    "company": "常州精灵车辆配件厂",
    "category": "注塑成型",
    "keywords": [
      "塑料配件"
    ],
    "region": {
      "province": "江苏",
      "city": "常州",
      "district": "新北"
    },
    "address": "孟河镇石桥转盘向西500米",
    "contact_phone": "待核实",
    "lat": 32.002353,
    "lng": 119.843335,
    "source": "public_directory",
    "source_url": "https://www.amap.com/place/B0FFHRXW19",
    "verified_at": "2026-08-13",
    "is_template": true,
    "note": "",
    "amap": {
      "poi_id": "B0FFHRXW19",
      "type": "公司企业;公司;公司",
      "typecode": "170200",
      "alias": "",
      "tag": "",
      "keytag": "工厂",
      "website": "",
      "email": "",
      "postcode": "",
      "business_area": "",
      "adcode": "320411",
      "search_keyword": "塑料配件"
    },
    "status": "unverified_poi",
    "industry": {
      "code": "3715",
      "name": "铁路机车车辆配件制造",
      "level": "class",
      "path": "C 制造业 > 铁路、船舶、航空航天和其他运输设备制造业 > 铁路运输设备制造 > 铁路机车车辆配件制造",
      "confidence": "high",
      "source": "gb_token",
      "evidence": "车辆配件"
    },
    "is_manufacturer": true
  }
]