[
  {
    "id": "CN-MFG-0158455",
    "company": "旭板玻璃工业有限公司",
    "category": "原材料",
    "keywords": [
      "钢化玻璃"
    ],
    "region": {
      "province": "广东",
      "city": "佛山",
      "district": "南海区"
    },
    "address": "工业大道12号",
    "contact_phone": "0757-86692628",
    "lat": 23.119225,
    "lng": 113.024978,
    "source": "public_directory",
    "source_url": "",
    "verified_at": "2026-09-25",
    "imported_at": "2026-09-25",
    "last_verified_at": null,
    "status": "verified",
    "is_template": false,
    "note": "",
    "amap": {
      "poi_id": "B02F50428T",
      "type": "公司企业;公司;公司",
      "typecode": "170200",
      "alias": "",
      "tag": "",
      "keytag": "玻璃厂",
      "website": "",
      "email": "",
      "postcode": "",
      "business_area": "",
      "adcode": "440605",
      "search_keyword": "钢化玻璃"
    },
    "industry": {
      "code": "3041",
      "name": "平板玻璃制造",
      "level": "class",
      "path": "C 制造业 > 非金属矿物制品业 > 玻璃制造 > 平板玻璃制造",
      "confidence": "high",
      "source": "gb_token",
      "evidence": "板玻璃"
    },
    "is_manufacturer": true
  }
]