[
  {
    "id": "CN-MFG-0161817",
    "company": "好邻居生活用品大全",
    "category": "批发和零售业",
    "keywords": [
      "钢材批发"
    ],
    "region": {
      "province": "天津",
      "city": "天津",
      "district": "北辰区"
    },
    "address": "青光镇津霸支线",
    "contact_phone": "180****6696",
    "lat": 39.199819,
    "lng": 117.03465,
    "source": "public_directory",
    "source_url": "",
    "verified_at": "2026-09-25",
    "imported_at": "2026-09-25",
    "last_verified_at": null,
    "status": "verified",
    "is_template": false,
    "note": "",
    "amap": {
      "poi_id": "B0FFHW7RFU",
      "type": "购物服务;便民商店/便利店;便民商店/便利店",
      "typecode": "060200",
      "alias": "",
      "tag": "",
      "keytag": "日杂店",
      "website": "",
      "email": "",
      "postcode": "",
      "business_area": "",
      "adcode": "120113",
      "search_keyword": "钢材批发"
    },
    "industry": {
      "code": "5296",
      "name": "生活用燃料零售",
      "level": "class",
      "path": "F 批发和零售业 > 零售业 > 货摊、无店铺及其他零售业 > 生活用燃料零售",
      "confidence": "high",
      "source": "gb_token",
      "evidence": "生活用"
    },
    "is_manufacturer": false
  }
]