[
  {
    "id": "CN-MFG-0054372",
    "company": "车耀兴·车衣改色·导航360改装中心",
    "category": "精密机械加工",
    "keywords": [
      "汽车维修",
      "汽修",
      "汽车修理",
      "修车"
    ],
    "region": {
      "province": "上海",
      "city": "上海",
      "district": "静安"
    },
    "address": "柳营路777号盛源生活广场B2层",
    "contact_phone": "待核实",
    "lat": 31.26416,
    "lng": 121.455596,
    "source": "public_directory",
    "source_url": "https://www.amap.com/place/B0J1R7ISIH",
    "verified_at": "2026-09-15",
    "imported_at": "2026-09-15",
    "last_verified_at": null,
    "status": "unverified_poi",
    "is_template": true,
    "note": "",
    "amap": {
      "poi_id": "B0J1R7ISIH",
      "type": "汽车维修;汽车维修;汽车维修",
      "typecode": "030000",
      "alias": "",
      "tag": "",
      "keytag": "补胎",
      "website": "",
      "email": "",
      "postcode": "",
      "business_area": "和田",
      "adcode": "310106",
      "search_keyword": "汽车维修"
    },
    "industry": {
      "code": "4023",
      "name": "导航、测绘、气象及海洋专用仪器制造",
      "level": "class",
      "path": "C 制造业 > 仪器仪表制造业 > 专用仪器仪表制造 > 导航、测绘、气象及海洋专用仪器制造",
      "confidence": "high",
      "source": "gb_token",
      "evidence": "导航"
    },
    "is_manufacturer": true
  }
]