[
  {
    "id": "CN-MFG-0079749",
    "company": "上海安凸塑料添加剂有限公司",
    "category": "注塑成型",
    "keywords": [
      "塑料模具"
    ],
    "region": {
      "province": "上海",
      "city": "上海",
      "district": "嘉定"
    },
    "address": "兴贤路1368号5幢东",
    "contact_phone": "021-59545950; 021-59545951",
    "lat": 31.430876,
    "lng": 121.179807,
    "source": "public_directory",
    "source_url": "https://www.amap.com/place/B0FFGMYG6U",
    "verified_at": "2026-09-16",
    "imported_at": "2026-09-16",
    "last_verified_at": null,
    "status": "verified",
    "is_template": false,
    "note": "",
    "amap": {
      "poi_id": "B0FFGMYG6U",
      "type": "公司企业;公司;公司",
      "typecode": "170200",
      "alias": "",
      "tag": "",
      "keytag": "公司",
      "website": "",
      "email": "",
      "postcode": "",
      "business_area": "",
      "adcode": "310114",
      "search_keyword": "塑料模具"
    },
    "industry": {
      "code": "1495",
      "name": "食品及饲料添加剂制造",
      "level": "class",
      "path": "C 制造业 > 食品制造业 > 其他食品制造 > 食品及饲料添加剂制造",
      "confidence": "high",
      "source": "gb_token",
      "evidence": "料添加剂"
    },
    "is_manufacturer": true
  }
]