[
  {
    "id": "CN-MFG-0057112",
    "company": "Youride吉瑞汇音响改装汽车隔音",
    "category": "精密机械加工",
    "keywords": [
      "汽车维修",
      "汽修",
      "汽车修理"
    ],
    "region": {
      "province": "广东",
      "city": "佛山",
      "district": "禅城"
    },
    "address": "佛山大道中57号(创产5号门旁)一楼",
    "contact_phone": "172****6383",
    "lat": 23.01498,
    "lng": 113.101327,
    "source": "public_directory",
    "source_url": "https://www.amap.com/place/B0LU3H98QU",
    "verified_at": "2026-09-15",
    "imported_at": "2026-09-15",
    "last_verified_at": null,
    "status": "verified",
    "is_template": false,
    "note": "",
    "amap": {
      "poi_id": "B0LU3H98QU",
      "type": "生活服务;生活服务场所;生活服务场所",
      "typecode": "070000",
      "alias": "",
      "tag": "",
      "keytag": "汽车维修",
      "website": "",
      "email": "",
      "postcode": "",
      "business_area": "石湾",
      "adcode": "440604",
      "search_keyword": "汽车维修"
    },
    "industry": {
      "code": "3630",
      "name": "改装汽车制造",
      "level": "class",
      "path": "C 制造业 > 汽车制造业 > 改装汽车制造 > 改装汽车制造",
      "confidence": "high",
      "source": "gb_token",
      "evidence": "改装汽车"
    },
    "is_manufacturer": true
  },
  {
    "id": "CN-MFG-0158230",
    "company": "无锡电装汽车部件有限公司",
    "category": "精密机械加工",
    "keywords": [
      "汽车零部件"
    ],
    "region": {
      "province": "江苏",
      "city": "无锡",
      "district": "新吴区"
    },
    "address": "梅育路97号",
    "contact_phone": "0510-88156611",
    "lat": 31.532214,
    "lng": 120.454414,
    "source": "public_directory",
    "source_url": "",
    "verified_at": "2026-09-25",
    "imported_at": "2026-09-25",
    "last_verified_at": null,
    "status": "verified",
    "is_template": false,
    "note": "",
    "amap": {
      "poi_id": "B01FE1DNV5",
      "type": "公司企业;公司;公司",
      "typecode": "170200",
      "alias": "",
      "tag": "",
      "keytag": "公司",
      "website": "",
      "email": "",
      "postcode": "",
      "business_area": "",
      "adcode": "320214",
      "search_keyword": "汽车零部件"
    },
    "industry": {
      "code": "3630",
      "name": "改装汽车制造",
      "level": "class",
      "path": "C 制造业 > 汽车制造业 > 改装汽车制造 > 改装汽车制造",
      "confidence": "high",
      "source": "gb_token",
      "evidence": "装汽车"
    },
    "is_manufacturer": true
  }
]