[
  {
    "id": "CN-MFG-0033567",
    "company": "煜焊机电批发焊材(销售专业维修焊机)",
    "category": "批发和零售业",
    "keywords": [
      "工具批发"
    ],
    "region": {
      "province": "广东",
      "city": "佛山",
      "district": "南海"
    },
    "address": "狮山镇小塘莲子塘东北村梁厚栋自编1号商铺",
    "contact_phone": "186****1619",
    "lat": 23.139504,
    "lng": 112.947503,
    "source": "public_directory",
    "source_url": "https://www.amap.com/place/B0IGS740XJ",
    "verified_at": "2026-09-14",
    "imported_at": "2026-09-14",
    "last_verified_at": null,
    "status": "verified",
    "is_template": false,
    "note": "",
    "amap": {
      "poi_id": "B0IGS740XJ",
      "type": "购物服务;家居建材市场;建材五金市场",
      "typecode": "060603",
      "alias": "",
      "tag": "",
      "keytag": "五金",
      "website": "",
      "email": "",
      "postcode": "",
      "business_area": "",
      "adcode": "440605",
      "search_keyword": "工具批发"
    },
    "industry": {
      "code": "5138",
      "name": "日用家电批发",
      "level": "class",
      "path": "F 批发和零售业 > 批发业 > 纺织、服装及家庭用品批发 > 日用家电批发",
      "confidence": "high",
      "source": "gb_token",
      "evidence": "电批发"
    },
    "is_manufacturer": false,
    "agent": {
      "skill_url": "skills/vendors/CN-MFG-0033567/SKILL.md",
      "protocol": "skill",
      "capabilities": [
        "catalog"
      ],
      "verified": false
    }
  },
  {
    "id": "CN-MFG-0123688",
    "company": "金盛厨具地毯小家电批发部",
    "category": "批发和零售业",
    "keywords": [
      "钢材"
    ],
    "region": {
      "province": "贵州",
      "city": "遵义"
    },
    "address": "九龙街道办事处河滨路",
    "contact_phone": "183****7898",
    "lat": 28.31803,
    "lng": 106.211849,
    "source": "public_directory",
    "source_url": "",
    "verified_at": "2026-09-17",
    "imported_at": "2026-09-17",
    "last_verified_at": null,
    "status": "verified",
    "is_template": false,
    "note": "",
    "amap": {
      "poi_id": "B0LDGU3LWI",
      "type": "购物服务;家居建材市场;厨卫市场",
      "typecode": "060604",
      "alias": "",
      "tag": "",
      "keytag": "厨卫洁具",
      "website": "",
      "email": "",
      "postcode": "",
      "business_area": "",
      "adcode": "520330",
      "search_keyword": "钢材"
    },
    "industry": {
      "code": "5138",
      "name": "日用家电批发",
      "level": "class",
      "path": "F 批发和零售业 > 批发业 > 纺织、服装及家庭用品批发 > 日用家电批发",
      "confidence": "high",
      "source": "gb_token",
      "evidence": "家电批发"
    },
    "is_manufacturer": false,
    "agent": {
      "skill_url": "skills/vendors/CN-MFG-0123688/SKILL.md",
      "protocol": "skill",
      "capabilities": [
        "catalog"
      ],
      "verified": false
    }
  },
  {
    "id": "CN-MFG-0180836",
    "company": "九龙管业水电批发部",
    "category": "批发和零售业",
    "keywords": [
      "五金批发",
      "五金店"
    ],
    "region": {
      "province": "江苏",
      "city": "苏州",
      "district": "姑苏区"
    },
    "address": "解放西路161之1-3号",
    "contact_phone": "159****2603",
    "lat": 31.276267,
    "lng": 120.593501,
    "source": "public_directory",
    "source_url": "",
    "verified_at": "2026-10-04",
    "imported_at": "2026-10-04",
    "last_verified_at": null,
    "status": "verified",
    "is_template": false,
    "note": "",
    "amap": {
      "poi_id": "B0200187D1",
      "type": "购物服务;家居建材市场;建材五金市场",
      "typecode": "060603",
      "alias": "",
      "tag": "",
      "keytag": "五金",
      "website": "",
      "email": "",
      "postcode": "",
      "business_area": "友新",
      "adcode": "320508",
      "search_keyword": "五金批发"
    },
    "industry": {
      "code": "5138",
      "name": "日用家电批发",
      "level": "class",
      "path": "F 批发和零售业 > 批发业 > 纺织、服装及家庭用品批发 > 日用家电批发",
      "confidence": "high",
      "source": "gb_token",
      "evidence": "电批发"
    },
    "is_manufacturer": false
  }
]