[
  {
    "id": "CN-MFG-0064631",
    "company": "南京航空航天大学(明故宫校区)后勤集团车辆运输中心",
    "category": "制造业",
    "keywords": [
      "汽车维修",
      "汽修",
      "汽车修理",
      "修车"
    ],
    "region": {
      "province": "江苏",
      "city": "南京",
      "district": "秦淮"
    },
    "address": "御道街29号南京航空航天大学(明故宫校区)",
    "contact_phone": "待核实",
    "lat": 32.033088,
    "lng": 118.817658,
    "source": "public_directory",
    "source_url": "https://www.amap.com/place/B00191363U",
    "verified_at": "2026-09-15",
    "imported_at": "2026-09-15",
    "last_verified_at": null,
    "status": "unverified_poi",
    "is_template": true,
    "note": "",
    "amap": {
      "poi_id": "B00191363U",
      "type": "生活服务;物流速递;物流速递",
      "typecode": "070500",
      "alias": "",
      "tag": "",
      "keytag": "汽车维修",
      "website": "",
      "email": "",
      "postcode": "",
      "business_area": "月牙湖",
      "adcode": "320104",
      "search_keyword": "汽车维修"
    },
    "industry": {
      "code": "4343",
      "name": "航空航天器修理",
      "level": "class",
      "path": "C 制造业 > 金属制品、机械和设备修理业 > 铁路、船舶、航空航天等运输设备修理 > 航空航天器修理",
      "confidence": "high",
      "source": "gb_token",
      "evidence": "航空航天"
    },
    "is_manufacturer": true
  }
]