[
  {
    "id": "CN-MFG-0157972",
    "company": "丰田汽车(常熟)零部件有限公司",
    "category": "精密机械加工",
    "keywords": [
      "汽车配件",
      "汽车零部件"
    ],
    "region": {
      "province": "江苏",
      "city": "苏州",
      "district": "常熟"
    },
    "address": "东南开发区黄浦江路68号",
    "contact_phone": "0512-52905588",
    "lat": 31.595657,
    "lng": 120.835111,
    "source": "public_directory",
    "source_url": "",
    "verified_at": "2026-09-25",
    "imported_at": "2026-09-25",
    "last_verified_at": null,
    "status": "verified",
    "is_template": false,
    "note": "",
    "amap": {
      "poi_id": "B0FFF4JN6W",
      "type": "公司企业;公司;公司",
      "typecode": "170200",
      "alias": "",
      "tag": "",
      "keytag": "公司",
      "website": "",
      "email": "",
      "postcode": "",
      "business_area": "",
      "adcode": "320581",
      "search_keyword": "汽车配件"
    },
    "industry": {
      "code": "3670",
      "name": "汽车零部件及配件制造",
      "level": "class",
      "path": "C 制造业 > 汽车制造业 > 汽车零部件及配件制造 > 汽车零部件及配件制造",
      "confidence": "high",
      "source": "gb_token",
      "evidence": "汽车零部件"
    },
    "is_manufacturer": true
  }
]