[
  {
    "id": "CN-MFG-0173277",
    "company": "慕贝尔汽车部件(太仓)有限公司汽车新能源港",
    "category": "批发和零售业",
    "keywords": [
      "汽车零部件"
    ],
    "region": {
      "province": "江苏",
      "city": "苏州",
      "district": "太仓"
    },
    "address": "娄江北路200号",
    "contact_phone": "待核实",
    "lat": 31.498525,
    "lng": 121.114375,
    "source": "public_directory",
    "source_url": "",
    "verified_at": "2026-10-02",
    "imported_at": "2026-10-02",
    "last_verified_at": null,
    "status": "unverified_poi",
    "is_template": true,
    "note": "",
    "amap": {
      "poi_id": "B0L21DSWR7",
      "type": "公司企业;工厂;工厂|公司企业;公司;公司",
      "typecode": "170300|170200",
      "alias": "",
      "tag": "",
      "keytag": "公司",
      "website": "",
      "email": "",
      "postcode": "",
      "business_area": "",
      "adcode": "320585",
      "search_keyword": "汽车零部件"
    },
    "industry": {
      "code": "5261",
      "name": "汽车新车零售",
      "level": "class",
      "path": "F 批发和零售业 > 零售业 > 汽车、摩托车、零配件和燃料及其他动力销售 > 汽车新车零售",
      "confidence": "high",
      "source": "gb_token",
      "evidence": "汽车新"
    },
    "is_manufacturer": false
  }
]