[
  {
    "id": "CN-MFG-0011337",
    "company": "溧阳市金瑞福生物质机械制造有限公司",
    "category": "精密机械加工",
    "keywords": [
      "机械加工",
      "电机制造"
    ],
    "region": {
      "province": "江苏",
      "city": "常州",
      "district": "溧阳"
    },
    "address": "昆仑街道泓盛路568号5幢",
    "contact_phone": "待核实",
    "lat": 31.464606,
    "lng": 119.445145,
    "source": "public_directory",
    "source_url": "https://www.amap.com/place/B0KGGZ7ET9",
    "verified_at": "2026-08-13",
    "is_template": true,
    "note": "",
    "amap": {
      "poi_id": "B0KGGZ7ET9",
      "type": "公司企业;公司;机械电子",
      "typecode": "170204",
      "alias": "",
      "tag": "",
      "keytag": "公司",
      "website": "",
      "email": "",
      "postcode": "",
      "business_area": "",
      "adcode": "320481",
      "search_keyword": "机械加工"
    },
    "industry": {
      "code": "254",
      "name": "生物质燃料加工",
      "level": "group",
      "path": "C 制造业 > 石油、煤炭及其他燃料加工业 > 生物质燃料加工",
      "confidence": "medium",
      "source": "gb_token",
      "evidence": "生物质"
    },
    "is_manufacturer": true,
    "status": "unverified_poi"
  }
]