[
  {
    "id": "CN-MFG-0010796",
    "company": "瑞宝塑料家具配件",
    "category": "注塑成型",
    "keywords": [
      "塑料配件"
    ],
    "region": {
      "province": "广东",
      "city": "佛山",
      "district": "顺德"
    },
    "address": "盈科三路b7-18号",
    "contact_phone": "0757-28913408; 139****3712; 189****7936",
    "lat": 22.888006,
    "lng": 113.054432,
    "source": "public_directory",
    "source_url": "https://www.amap.com/place/B0FFGEQTN2",
    "verified_at": "2026-08-13",
    "is_template": false,
    "note": "",
    "amap": {
      "poi_id": "B0FFGEQTN2",
      "type": "购物服务;家居建材市场;家具城|购物服务;专卖店;专营店",
      "typecode": "060602|061200",
      "alias": "",
      "tag": "",
      "keytag": "家具",
      "website": "",
      "email": "",
      "postcode": "",
      "business_area": "",
      "adcode": "440606",
      "search_keyword": "塑料配件"
    },
    "status": "verified",
    "industry": {
      "code": "2140",
      "name": "塑料家具制造",
      "level": "class",
      "path": "C 制造业 > 家具制造业 > 塑料家具制造 > 塑料家具制造",
      "confidence": "high",
      "source": "gb_token",
      "evidence": "塑料家具"
    },
    "is_manufacturer": true
  }
]