[
  {
    "id": "CN-MFG-0081705",
    "company": "粤A 葡萄酒.精酿",
    "category": "制造业",
    "keywords": [
      "清吧"
    ],
    "region": {
      "province": "广东",
      "city": "广州"
    },
    "address": "寺右一马路10号10商铺",
    "contact_phone": "待核实",
    "lat": 23.118733,
    "lng": 113.307916,
    "source": "public_directory",
    "source_url": "https://www.amap.com/place/B0JRJKG7GP",
    "verified_at": "2026-09-16",
    "imported_at": "2026-09-16",
    "last_verified_at": null,
    "status": "unverified_poi",
    "is_template": true,
    "note": "",
    "amap": {
      "poi_id": "B0JRJKG7GP",
      "type": "体育休闲服务;娱乐场所;酒吧",
      "typecode": "080304",
      "alias": "",
      "tag": "",
      "keytag": "清吧",
      "website": "",
      "email": "",
      "postcode": "",
      "business_area": "东湖",
      "adcode": "440104",
      "search_keyword": "清吧"
    },
    "industry": {
      "code": "1515",
      "name": "葡萄酒制造",
      "level": "class",
      "path": "C 制造业 > 酒、饮料和精制茶制造业 > 酒的制造 > 葡萄酒制造",
      "confidence": "high",
      "source": "name",
      "evidence": "葡萄酒"
    },
    "is_manufacturer": true
  }
]