[
  {
    "id": "CN-MFG-0048553",
    "company": "躺平coffee&bar宠物友好",
    "category": "居民服务、修理和其他服务业",
    "keywords": [
      "咖啡"
    ],
    "region": {
      "province": "江苏",
      "city": "苏州",
      "district": "姑苏"
    },
    "address": "学士街223号(养育巷地铁站3号口步行420米)",
    "contact_phone": "178****3724",
    "lat": 31.302492,
    "lng": 120.612084,
    "source": "public_directory",
    "source_url": "https://www.amap.com/place/B0LRSZ4EWF",
    "verified_at": "2026-09-15",
    "imported_at": "2026-09-15",
    "last_verified_at": null,
    "status": "verified",
    "is_template": false,
    "note": "",
    "amap": {
      "poi_id": "B0LRSZ4EWF",
      "type": "餐饮服务;咖啡厅;咖啡厅",
      "typecode": "050500",
      "alias": "",
      "tag": "coffee",
      "keytag": "咖啡",
      "website": "",
      "email": "",
      "postcode": "",
      "business_area": "南门",
      "adcode": "320508",
      "search_keyword": "咖啡"
    },
    "industry": {
      "code": "8229",
      "name": "其他宠物服务",
      "level": "class",
      "path": "O 居民服务、修理和其他服务业 > 其他服务业 > 宠物服务 > 其他宠物服务",
      "confidence": "medium",
      "source": "name",
      "evidence": "宠物"
    },
    "is_manufacturer": false
  },
  {
    "id": "CN-MFG-0048778",
    "company": "杭州卡皮巴拉宠物亲子漂流",
    "category": "居民服务、修理和其他服务业",
    "keywords": [
      "水上乐园"
    ],
    "region": {
      "province": "浙江",
      "city": "杭州",
      "district": "富阳"
    },
    "address": "万市镇方里村1号",
    "contact_phone": "139****8208",
    "lat": 30.113012,
    "lng": 119.487867,
    "source": "public_directory",
    "source_url": "https://www.amap.com/place/B0MGRUL152",
    "verified_at": "2026-09-15",
    "imported_at": "2026-09-15",
    "last_verified_at": null,
    "status": "verified",
    "is_template": false,
    "note": "",
    "amap": {
      "poi_id": "B0MGRUL152",
      "type": "体育休闲服务;休闲场所;游乐场",
      "typecode": "080501",
      "alias": "",
      "tag": "",
      "keytag": "水上活动中心",
      "website": "",
      "email": "",
      "postcode": "",
      "business_area": "",
      "adcode": "330111",
      "search_keyword": "水上乐园"
    },
    "industry": {
      "code": "8229",
      "name": "其他宠物服务",
      "level": "class",
      "path": "O 居民服务、修理和其他服务业 > 其他服务业 > 宠物服务 > 其他宠物服务",
      "confidence": "medium",
      "source": "name",
      "evidence": "宠物"
    },
    "is_manufacturer": false
  },
  {
    "id": "CN-MFG-0079483",
    "company": "星巴克(太仓点金商业广场店宠物友好)",
    "category": "居民服务、修理和其他服务业",
    "keywords": [
      "咖啡店"
    ],
    "region": {
      "province": "江苏",
      "city": "苏州",
      "district": "太仓"
    },
    "address": "南郊书院路101号3号楼地上1层155、156、157单元",
    "contact_phone": "0512-63106297",
    "lat": 31.422268,
    "lng": 121.128759,
    "source": "public_directory",
    "source_url": "https://www.amap.com/place/B0H2FSL96P",
    "verified_at": "2026-09-16",
    "imported_at": "2026-09-16",
    "last_verified_at": null,
    "status": "verified",
    "is_template": false,
    "note": "",
    "amap": {
      "poi_id": "B0H2FSL96P",
      "type": "餐饮服务;咖啡厅;星巴克咖啡",
      "typecode": "050501",
      "alias": "",
      "tag": "下午茶,单人餐",
      "keytag": "饮品",
      "website": "",
      "email": "",
      "postcode": "",
      "business_area": "太仓",
      "adcode": "320585",
      "search_keyword": "咖啡店"
    },
    "industry": {
      "code": "8229",
      "name": "其他宠物服务",
      "level": "class",
      "path": "O 居民服务、修理和其他服务业 > 其他服务业 > 宠物服务 > 其他宠物服务",
      "confidence": "medium",
      "source": "name",
      "evidence": "宠物"
    },
    "is_manufacturer": false
  },
  {
    "id": "CN-MFG-0111159",
    "company": "霸王茶姬(南宁民歌湖宠物友好主题店)",
    "category": "居民服务、修理和其他服务业",
    "keywords": [
      "奶茶"
    ],
    "region": {
      "province": "广西",
      "city": "南宁"
    },
    "address": "金浦路23号(民歌湖现代艺术酒吧街)地下演绎厅-S1号铺面",
    "contact_phone": "4008788359",
    "lat": 22.810795,
    "lng": 108.374545,
    "source": "public_directory",
    "source_url": "",
    "verified_at": "2026-09-17",
    "imported_at": "2026-09-17",
    "last_verified_at": null,
    "status": "verified",
    "is_template": false,
    "note": "",
    "amap": {
      "poi_id": "B0LA1UADC8",
      "type": "餐饮服务;冷饮店;冷饮店",
      "typecode": "050700",
      "alias": "",
      "tag": "",
      "keytag": "奶茶/茶饮",
      "website": "",
      "email": "",
      "postcode": "",
      "business_area": "竹溪大道",
      "adcode": "450103",
      "search_keyword": "奶茶"
    },
    "industry": {
      "code": "8229",
      "name": "其他宠物服务",
      "level": "class",
      "path": "O 居民服务、修理和其他服务业 > 其他服务业 > 宠物服务 > 其他宠物服务",
      "confidence": "medium",
      "source": "name",
      "evidence": "宠物"
    },
    "is_manufacturer": false
  },
  {
    "id": "CN-MFG-0147278",
    "company": "杭州橙萤宠物友好公寓",
    "category": "居民服务、修理和其他服务业",
    "keywords": [
      "民宿"
    ],
    "region": {
      "province": "浙江",
      "city": "杭州",
      "district": "余杭区"
    },
    "address": "仓前街道文一西路1329号富力中心2幢1021室",
    "contact_phone": "137****6958; 191****6003",
    "lat": 30.273529,
    "lng": 119.994152,
    "source": "public_directory",
    "source_url": "",
    "verified_at": "2026-09-22",
    "imported_at": "2026-09-22",
    "last_verified_at": null,
    "status": "verified",
    "is_template": false,
    "note": "",
    "amap": {
      "poi_id": "B0L69SVFTG",
      "type": "住宿服务;旅馆招待所;旅馆招待所",
      "typecode": "100200",
      "alias": "",
      "tag": "",
      "keytag": "民宿",
      "website": "",
      "email": "",
      "postcode": "",
      "business_area": "仓前",
      "adcode": "330110",
      "search_keyword": "民宿"
    },
    "industry": {
      "code": "8229",
      "name": "其他宠物服务",
      "level": "class",
      "path": "O 居民服务、修理和其他服务业 > 其他服务业 > 宠物服务 > 其他宠物服务",
      "confidence": "medium",
      "source": "name",
      "evidence": "宠物"
    },
    "is_manufacturer": false
  }
]