[
  {
    "id": "CN-MFG-0033668",
    "company": "宝岗体育场-游泳场",
    "category": "文化、体育和娱乐业",
    "keywords": [
      "游泳馆"
    ],
    "region": {
      "province": "广东",
      "city": "广州",
      "district": "海珠"
    },
    "address": "宝岗大道新凤祥93号宝岗球场内(近海幢街道)",
    "contact_phone": "020-34122605",
    "lat": 23.102061,
    "lng": 113.263842,
    "source": "public_directory",
    "source_url": "https://www.amap.com/place/B0FFHVR0NP",
    "verified_at": "2026-09-14",
    "imported_at": "2026-09-14",
    "last_verified_at": null,
    "status": "verified",
    "is_template": false,
    "note": "",
    "amap": {
      "poi_id": "B0FFHVR0NP",
      "type": "体育休闲服务;运动场馆;游泳馆",
      "typecode": "080110",
      "alias": "",
      "tag": "",
      "keytag": "游泳馆",
      "website": "",
      "email": "",
      "postcode": "",
      "business_area": "滨江",
      "adcode": "440105",
      "search_keyword": "游泳馆"
    },
    "industry": {
      "code": "8921",
      "name": "体育场馆管理",
      "level": "class",
      "path": "R 文化、体育和娱乐业 > 体育 > 体育场地设施管理 > 体育场馆管理",
      "confidence": "high",
      "source": "gb_token",
      "evidence": "体育场"
    },
    "is_manufacturer": false
  },
  {
    "id": "CN-MFG-0035033",
    "company": "深圳体育场",
    "category": "文化、体育和娱乐业",
    "keywords": [
      "球馆"
    ],
    "region": {
      "province": "广东",
      "city": "深圳",
      "district": "福田"
    },
    "address": "园岭街道南天社区笋岗西路2006号市体育中心内",
    "contact_phone": "待核实",
    "lat": 22.559472,
    "lng": 114.092056,
    "source": "public_directory",
    "source_url": "https://www.amap.com/place/B02F37SNBI",
    "verified_at": "2026-09-14",
    "imported_at": "2026-09-14",
    "last_verified_at": null,
    "status": "unverified_poi",
    "is_template": true,
    "note": "",
    "amap": {
      "poi_id": "B02F37SNBI",
      "type": "体育休闲服务;运动场馆;综合体育馆|体育休闲服务;运动场馆;足球场",
      "typecode": "080101|080105",
      "alias": "",
      "tag": "",
      "keytag": "综合场馆",
      "website": "www.szgym.com",
      "email": "",
      "postcode": "518035",
      "business_area": "上步",
      "adcode": "440304",
      "search_keyword": "球馆"
    },
    "industry": {
      "code": "8921",
      "name": "体育场馆管理",
      "level": "class",
      "path": "R 文化、体育和娱乐业 > 体育 > 体育场地设施管理 > 体育场馆管理",
      "confidence": "high",
      "source": "gb_token",
      "evidence": "体育场"
    },
    "is_manufacturer": false
  },
  {
    "id": "CN-MFG-0035143",
    "company": "广州市工人体育场",
    "category": "文化、体育和娱乐业",
    "keywords": [
      "球馆"
    ],
    "region": {
      "province": "广东",
      "city": "广州",
      "district": "荔湾"
    },
    "address": "环市西路7号(近富力环市西苑)",
    "contact_phone": "020-26282380; 020-26283669",
    "lat": 23.141719,
    "lng": 113.237455,
    "source": "public_directory",
    "source_url": "https://www.amap.com/place/B00140CJ59",
    "verified_at": "2026-09-14",
    "imported_at": "2026-09-14",
    "last_verified_at": null,
    "status": "verified",
    "is_template": false,
    "note": "",
    "amap": {
      "poi_id": "B00140CJ59",
      "type": "体育休闲服务;运动场馆;综合体育馆",
      "typecode": "080101",
      "alias": "",
      "tag": "",
      "keytag": "综合场馆",
      "website": "",
      "email": "",
      "postcode": "",
      "business_area": "西村",
      "adcode": "440103",
      "search_keyword": "球馆"
    },
    "industry": {
      "code": "8921",
      "name": "体育场馆管理",
      "level": "class",
      "path": "R 文化、体育和娱乐业 > 体育 > 体育场地设施管理 > 体育场馆管理",
      "confidence": "high",
      "source": "gb_token",
      "evidence": "体育场"
    },
    "is_manufacturer": false
  },
  {
    "id": "CN-MFG-0169105",
    "company": "武汉市武泰闸体育场",
    "category": "文化、体育和娱乐业",
    "keywords": [
      "球馆"
    ],
    "region": {
      "province": "湖北",
      "city": "武汉",
      "district": "武昌区"
    },
    "address": "武泰闸三角塘14号(紫阳湖地铁站A口步行480米)",
    "contact_phone": "待核实",
    "lat": 30.522525,
    "lng": 114.301959,
    "source": "public_directory",
    "source_url": "",
    "verified_at": "2026-10-01",
    "imported_at": "2026-10-01",
    "last_verified_at": null,
    "status": "unverified_poi",
    "is_template": true,
    "note": "",
    "amap": {
      "poi_id": "B001B0IZW6",
      "type": "体育休闲服务;运动场馆;综合体育馆",
      "typecode": "080101",
      "alias": "",
      "tag": "",
      "keytag": "综合场馆",
      "website": "",
      "email": "",
      "postcode": "",
      "business_area": "紫阳路",
      "adcode": "420106",
      "search_keyword": "球馆"
    },
    "industry": {
      "code": "8921",
      "name": "体育场馆管理",
      "level": "class",
      "path": "R 文化、体育和娱乐业 > 体育 > 体育场地设施管理 > 体育场馆管理",
      "confidence": "high",
      "source": "gb_token",
      "evidence": "体育场"
    },
    "is_manufacturer": false
  }
]